ID,Position,Scouting Report Sentence(s),Race
2039,CB,QualityECON Exprsv RitualExprsv Role HU PtLwStrong SpacePositiv Pstv Affil Strong Passive Arousal EMOT AffOth AffTot,NW
2040,CB,Active Work IAVStrong Virtue EndsLwPositiv Nonadlt IndAdj,NW
2041,CB,Affil Strong Role Kin@ MALE HU AffPt AffTot,NW
2042,CB,Positiv Pstv Affil Active Virtue EVAL MeansLwPositiv Nonadlt IndAdj,NW
2043,CB,Legal Role HU SklPt SklTOTStrong Active Complet IAV TrnGainKnow EnlGain EnlTot,NW
2044,CB,Submit Passive Role HU,NW
2045,CB,Virtue Ovrst EVALPositiv Pstv FinishPositiv Feel Arousal Doctrin,NW
2046,CB,Ritual,NW
2047,CB,Positiv Pstv Strong Virtue PosAffObject Tool,NW
2048,CB,Positiv Strong VirtueABS DIST Space TimeSpc,NW
2049,CB,Strong Power Active SocRel IAVNegativ Ngtv Weak Passive Fail IAV PowCon PowTotEcon@ ECON ComForm COM FormLw,NW
2050,CB,Positiv NatrPro Know IndAdjPassive ArousalStrong Active Increas EndsLw,NW
2051,CB,Positiv Strong Virtue EVAL Abs@ ABS MeansLwPower Active TravelPositiv Eval@ Quality IndAdj,NW
2052,CB,SpaceStrong Active Travel PowPt PowTot TranLwOvrst Know SureLwEcon@ ECON ComForm COM FormLw,NW
2053,CB,,NW
2054,CB,Active Causal TrnGainPerceiv EnlOth EnlTotBodyPt,NW
2055,CB,Passive Goal EnlOth EnlTotKnowStrong ECON CompletStrong Ovrst SureLw,NW
2056,CB,Solve IAVActive Abs@ ABS SpacePositiv Feel Arousal Doctrin,NW
2057,CB,Solve IAVStrong ECON CompletComForm IAV RspOth RspTot,NW
2058,CB,Strong Active Complet IAV TrnGainStrong ComForm EnlOth EnlTot FormLw,NW
2059,CB,Negativ Ngtv Hostile ArousalSpaceWeak Undrst FREQ TimeSpcPositiv Nonadlt IndAdjStrong Active Exert Abs@ ABS TranLwNegativ Active ComForm IAV,NW
2060,CB,Active Causal TrnGainHostile Strong Power Active ComForm IAV PowCon PowTotStrong Active Complet IAV TrnGain,NW
2061,CB,Power ECON Polit@ POLIT COLL HU PowAuPt PowTotPassive Arousal EndsLwPositiv Pstv Strong Active Virtue WlbPsyc WlbTot,NW
2062,CB,QualityPositiv Pstv Affil Strong Active Role HU,NW
2063,CB,Positiv Strong Virtue EVAL Abs@ ABS MeansLwObject Tool,NW
2064,CB,Strong Ovrst Quan SureLwNegativ Hostile ViceSolve DAV TrnGain,NW
2065,CB,Strong Active Complet IAV TrnGainPositiv Pstv Virtue Abs@ ABS EndsLw,NW
2066,CB,Positiv Nonadlt IndAdj,NW
2067,CB,Positiv Pstv Strong Virtue EndsLwPower Active TravelFinishStrong Active Complet IAV TrnGain,NW
2068,CB,PowOth PowTotNegativ Ngtv Hostile Strong Active Vice PowCon PowTotKnow WlbPsyc WlbTot,NW
2069,CB,PerceivRitual,NW
2070,CB,Strong Active Solve IAV TranLwSpaceStrong Active Complet IAV TrnGainMeans WltOth WltTot,NW
2071,CB,ABS DIST Space TimeSpcVirtue SklOth SklTOT,NW
2072,CB,Quality,NW
2073,CB,Power ComForm EnlGain EnlTotSolve IAV,NW
2074,CB,Positiv Econ@ Quan WltOth WltTotEcon@ ECON ComForm COM FormLw,NW
2075,CB,Negativ Ngtv Passive Need EndsLwPositiv Nonadlt IndAdjIAV RcEthic RcTotLegal Role HU SklPt SklTOTStrong Work DAV PowOth PowTotPassive Arousal,NW
2076,CB,Positiv Feel Arousal DoctrinPositiv Nonadlt IndAdj,NW
2077,CB,,NW
2078,CB,Virtue Ovrst RcEnds RcTot FormLwNegativ Ngtv Hostile Weak Vice WlbPhys WlbTot,NW
2079,CB,Strong Power Active Pleasur SureLwNegativ Ngtv Hostile Strong SocRel IAV TrnLoss,NW
2080,CB,Positiv Pstv Strong Virtue PosAffBodyPtSubmit Passive Role HUStrong ComForm IAV PowOth PowTot,NW
2081,CB,Positiv Pstv Virtue EVAL WltOth WltTotActive Abs@ ABS SpaceMeans Abs@ ABS,NW
2082,CB,Ovrst QuanStrong Work DAV PowOth PowTotPLACE Region TimeSpcPower ComForm EnlGain EnlTot,NW
2083,CB,Positiv Pstv Strong Virtue EndsLwPassive Goal EnlOth EnlTotECON Exprsv Ritual,NW
2084,CB,Strong Power Active ComForm IAV EnlOth EnlTotPositiv Feel Arousal DoctrinStrong Active Rel IAV,NW
2085,CB,ABS DIST Space TimeSpcPositiv Strong Active Increas,NW
2086,CB,Positiv Pstv Virtue EVAL PosAffPerceiv EnlOth EnlTotActive Travel TranLwQuan,NW
2087,CB,,NW
2088,CB,Positiv Eval@ Quality IndAdjTravel IAVAcadem Doctrin EnlOth EnlTot,NW
2089,CB,Strong Ovrst Know EVAL SureLw,NW
2090,CB,Active Academ Try IAV EnlEnds EnlTotPositiv Pstv Strong Virtue EVAL SklOth SklTOT,NW
2091,CB,BodyPt,NW
2092,CB,Strong Power Active SocRel IAVNegativ Ngtv Hostile Active Exert DAV TranLwHostile Strong Active Stay IAV PowCon PowTotSubmit Passive Role HUPositiv Pstv Strong Virtue MeansLw,NW
2093,CB,Negativ Ngtv Weak Passive Persist IAV TranLwSpaceEcon@ ECON ComForm COM FormLw,NW
2094,CB,Solve IAVPower Active TravelNegativ Ngtv Strong Active NatrPro PowOth PowTotSpace,NW
2095,CB,SpaceNegate SVStrong Ovrst Means EndsLw,NW
2096,CB,Solve IAVStrong ComForm EnlOth EnlTot FormLwArousal EndsLw,NW
2097,CB,Space,NW
2098,CB,Object Tool,NW
2099,CB,ABS DIST Space TimeSpc,NW
2100,LB,Active Try IAV TranLwKnow WlbPsyc WlbTot,NW
2101,LB,ECON Exprsv Ritual,NW
2102,LB,Active Travel IAV TranLwECON Exprsv Ritual,NW
2103,LB,Positiv Nonadlt IndAdjPositiv Pstv Strong Virtue EndsLwQuality,NW
2104,LB,Passive Arousal EMOTPassive Goal EnlOth EnlTot,NW
2105,LB,Space,NW
2106,LB,Positiv Strong NatrProSpaceHostile ComForm PowCon PowTot FormLw,NW
2107,LB,Positiv Pstv Affil ComForm COM PowCoop PowTot FormLwPositiv Pstv Active Work IAV,NW
2108,LB,Virtue Ovrst EVALStrong Quality TimeSpcPositiv FeelNegativ Ngtv Hostile ArousalSpace,NW
2109,LB,Positiv Pstv Strong Virtue EndsLwQualityFinish,NW
2110,LB,Solve IAVPositiv Pstv Strong Virtue Exprsv,NW
2111,LB,Active Econ@ Role HU EnlPt EnlTot,NW
2112,LB,Strong Active Fall IAVObject Tool,NW
2113,LB,Negativ Ngtv Passive Need EndsLwPositiv Pstv Strong Virtue EndsLwPositiv Feel Arousal DoctrinStrong Milit Role HU PowAuPt PowTot,NW
2114,LB,Positiv Nonadlt IndAdjStrong Active Fall IAVStrong Quan DIMPositiv Nonadlt IndAdj,NW
2115,LB,Solve IAVStrong Work DAV PowOth PowTotPositiv Strong VirtueHostile SocRel,NW
2116,LB,Ovrst QuanActive Exert DAV,NW
2117,LB,Submit Econ@ ECON Role HU WltPt WltTotPower ComForm EnlGain EnlTotSpace,NW
2118,CB,Strong Active Rel IAV TrnGainPositiv Pstv Strong Virtue ExprsvPositiv Strong Virtue EVAL Abs@ ABS MeansLw,NW
2119,CB,BodyPtPositiv Pstv Virtue EVAL,NW
2120,CB,Positiv Pstv Virtue Academ EnlOth EnlTotPositiv Feel Arousal DoctrinPositiv Pstv Strong Active Virtue TrnGainCausal If,NW
2121,CB,Negativ Ngtv Hostile Weak Passive SocRel PowCon PowTotPositiv Feel Arousal Doctrin,NW
2122,CB,Strong Work DAV PowOth PowTotCOLL HUActive Rise DAV TranLwPositiv Feel Arousal Doctrin,NW
2123,CB,Hostile SocRelStrong Active Complet IAV TrnGainStrong ComForm EnlOth EnlTot FormLw,NW
2124,CB,Academ Doctrin EnlOth EnlTotPositiv Pstv Strong Active Virtue TrnGain,NW
2125,CB,Positiv Eval@ Quality IndAdjStrong Active Complet IAV PowGain PowTotStrong EVAL Quality,NW
2126,CB,Strong Active Polit@ POLIT RitualNegativ Ngtv Hostile Strong Active SocRel IAV TrnLoss,NW
2127,CB,Strong QualitySpaceStrong Ovrst Know EVAL SureLw,NW
2128,CB,Strong Means EndsLwPositiv Pstv Strong Power Pleasur EMOT Ovrst WlbPsyc WlbTotObject ToolNegativ Ngtv Weak Passive Vice EndsLw,NW
2129,CB,Perceiv EnlOth EnlTotSolve IAV,NW
2130,CB,Solve IAVEcon@ ECON ComForm COM FormLwPositiv Econ@ Quan WltOth WltTot,NW
2131,CB,Know WlbPsyc WlbTotAffil ComFormObject ComnObj,NW
2132,CB,Negativ Ngtv Passive Need EndsLw,NW
2133,CB,Positiv Pstv Virtue Academ EnlOth EnlTot,NW
2134,LB,Econ@ ECON Rel PowOth PowTotStrong Ovrst Quan SureLw,NW
2135,LB,Passive Arousal EndsLwNegativ Ngtv Strong Active NatrPro PowOth PowTot,NW
2136,LB,Active Academ Try IAV EnlEnds EnlTotEcon@ ECON Polit@ POLIT COLL HU,NW
2137,LB,QualityBodyPtStrong Ovrst Means EndsLwPower ComForm EnlGain EnlTotActive Travel EndsLw,NW
2138,LB,Object ToolPositiv Nonadlt IndAdjPositiv Nonadlt IndAdj,NW
2139,LB,PLACE Region TimeSpcStrong Active Fall IAVPositiv Nonadlt IndAdj,NW
2140,LB,Positiv Strong Virtue EVAL Abs@ ABS MeansLwVary TranLw,NW
2141,LB,Negativ Ngtv Hostile Power Passive Vice PowOth PowTotPositiv Strong Virtue EVAL Abs@ ABS MeansLwStrong Power Causal PowLoss PowTotNegativ Decreas,NW
2142,LB,Positiv Nonadlt IndAdjStrong Power Active WorkMeans WltOth WltTot,NW
2143,LB,Positiv Pstv Virtue Legal PowAuth PowTotObject FoodPositiv Econ@ Quan WltOth WltTot,NW
2144,LB,Positiv NatrPro Know IndAdjSolve IAV,NW
2145,LB,Negativ OvrstPassive Means EnlOth EnlTotPositiv Nonadlt IndAdjStrong Active Increas EndsLw,NW
2146,LB,Positiv Pstv Active ComForm DAV EnlGain EnlTotHostile ComForm PowCon PowTot FormLw,NW
2147,LB,Negativ Hostile SocRel Exert,NW
2148,LB,Positiv Nonadlt IndAdjNatrProPositiv NatrPro Know IndAdj,NW
2149,LB,IAV RcEthic RcTotPositiv Pstv Strong Virtue Exprsv,NW
2150,LB,Legal Role HU SklPt SklTOTSpace TimeSpc,NW
2151,LB,Object BldgPt,NW
2152,DT,Object ToolStrong Quality,NW
2153,DT,Positiv Eval@ Quality IndAdjHostile Role HU PowPt PowTotMeans,NW
2154,DT,Negativ Ngtv Strong Active NatrPro PowOth PowTotPositiv Pstv Active ComForm DAV EnlGain EnlTotActive Solve IAVBodyPt,NW
2155,DT,Quality,NW
2156,DT,,NW
2157,DT,Solve IAVObject BldgPt TimeSpcPositiv Pstv Affil Strong Active Role HU,NW
2158,DT,Strong Active Fall IAV,NW
2159,DT,Strong Active Work IAVObject Tool,NW
2160,DT,Positiv Know PerceivNegativ Ngtv Role HUWork IAV,NW
2161,DT,QualityBodyPtPositiv Strong Virtue,NW
2162,DT,Active Causal TrnGainActive Exert Abs@ ABS EndsLwFinishPositiv Nonadlt IndAdj,NW
2163,DT,Negativ Ngtv Passive Need EndsLwStrong Passive Increas EndsLwPositiv Pstv Strong Abs@ ABS Time@ RspOth RspTot,NW
2164,DT,Solve IAVPassive Arousal EMOT,NW
2165,DT,Positiv Pstv Active ComForm DAV EnlGain EnlTot,NW
2166,DT,Negativ OvrstSpaceStrong Quan,NW
2167,DT,Negativ Ngtv Passive Need EndsLwPositiv Pstv Virtue Academ EnlOth EnlTotStrong Power Econ@ Role HU WltPt WltTotStrong Active Exert Abs@ ABS TranLw,NW
2168,DT,Travel IAVFinish IAVStrong Work DAV PowOth PowTot,NW
2169,DT,Negativ Ngtv Passive Need EndsLwActive Travel TranLwActive Travel TranLw,NW
2170,RB,Ovrst Quan,NW
2171,RB,Negativ Weak Active Fail IAV,NW
2172,RB,Positiv Know PerceivLegal Role HU SklPt SklTOTQualityPositiv Active SocRel IAVStrong ComForm EnlOth EnlTot FormLw,NW
2173,RB,Weak Submit Passive Rel DAVPositiv Strong VirtueVirtue SklOth SklTOT,NW
2174,RB,Submit Passive Role HU PowPt PowTotPositiv Pstv Affil SocRel IAV AffGain AffTotVirtue SklOth SklTOTStrong Active Exert IAVStrong Milit Role HU PowAuPt PowTot,NW
2175,RB,Ovrst QuanStrong Work DAV PowOth PowTotBodyPt WlbPhys WlbTotWeak Submit Passive Rel DAV,NW
2176,RB,Strong Power Active WorkNegativ Ngtv Weak Passive Fail IAV PowCon PowTot,NW
2177,RB,Solve IAVPositiv Affil Strong IndAdj,NW
2178,RB,Legal Role HU SklPt SklTOTABS DIST Space TimeSpc,NW
2179,RB,Negativ Ngtv Hostile Strong Active SocRel IAV TrnLoss,NW
2180,RB,,NW
2181,RB,Passive Arousal EMOTSolve IAV,NW
2182,RB,Strong Active Exert IAV,NW
2183,RB,Solve IAVPositiv Pstv Active Virtue Abs@ ABS EndsLwQuality,NW
2184,RB,Means WltOth WltTotPassive PerceivSolve IAV,NW
2185,RB,Object ToolObject BldgPt TimeSpcPositiv Pstv Active ComForm DAV EnlGain EnlTot,NW
2186,RB,Positiv Pstv Active ComForm DAV EnlGain EnlTot,NW
2187,RB,Hostile Strong Power Active Milit SocRel IAV PowCon PowTotPositiv Pstv Strong Active Virtue SklOth SklTOTStrong Increas,NW
2188,RB,Virtue SklOth SklTOT,NW
2189,CB,Quality,NW
2190,CB,Positiv Pstv Passive Virtue,NW
2191,CB,Positiv Nonadlt IndAdjPassive Arousal,NW
2192,CB,PLACE Region TimeSpcABS DIST Space TimeSpcPower ComForm EnlGain EnlTot,NW
2193,CB,Submit Passive Role HUBodyPtAbs@ ABS Time@,NW
2194,CB,Negativ Ngtv Hostile Active Virtue PowCon PowTotSpace,NW
2195,CB,Positiv Nonadlt IndAdj,NW
2196,CB,Strong Active Fall IAV,NW
2197,CB,Passive Arousal EMOTPositiv Nonadlt IndAdjSubmit Passive Role HU,NW
2198,CB,Academ Doctrin EnlOth EnlTotPositiv Nonadlt IndAdj,NW
2199,CB,Strong Active Travel PowPt PowTot TranLwPositiv Pstv Strong Virtue EndsLw,NW
2200,CB,,NW
2201,CB,Negativ Ngtv Vice Ovrst EVAL NegAffActive TravelNegativ Ngtv Weak Active Fail DAV,NW
2202,CB,BodyPtComForm IAV RspOth RspTot,NW
2203,CB,NatrPro,NW
2204,CB,QualityStrong Power Econ@ Role HU WltPt WltTotStrong Work DAV PowOth PowTot,NW
2205,CB,Object ToolPLACE Route,NW
2206,CB,Negativ Ngtv Hostile ArousalSpaceNegativ Active ComForm IAV,NW
2207,WR,Econ@ ECON Rel PowOth PowTot,NW
2208,WR,Strong Quan DIMPositiv Nonadlt IndAdj,NW
2209,WR,Active ECON MeansSpace,NW
2210,WR,Positiv Strong Virtue EVAL Abs@ ABS MeansLwPositiv Pstv Strong Active Exprsv Begin IAV EndsLwStrong Active Travel PowPt PowTot TranLwSpaceQuality,NW
2211,WR,Time@ TimeSpcPositiv Pstv Passive Virtue,NW
2212,WR,Solve IAVStrong Active Complet IAV TrnGainPerceiv IAV EnlOth EnlTotStrong Space,NW
2213,WR,Positiv Econ@ Quan WltOth WltTot,NW
2214,WR,Causal IfNegativ Ngtv Weak Passive Vice Abs@ ABS WltTran WltTotStrong Space,NW
2215,WR,Solve IAVStrong Means EndsLw,NW
2216,WR,Positiv Pstv Strong Virtue EndsLw,NW
2217,WR,Negativ Ngtv Weak Passive Vice SklOth SklTOTNegativ Ngtv Weak Passive Fail IAV PowCon PowTot,NW
2218,WR,BodyPtStrong Active Complet IAV PowGain PowTotSpaceStrong SpacePositiv Strong Active Increas,NW
2219,WR,,NW
2220,WR,Strong Active Complet IAV TrnGain,NW
2221,WR,Perceiv IAV EnlOth EnlTotNegativ Ngtv Weak Active Fail DAVNegativ OvrstStrong Active Complet IAV TrnGainSpace,NW
2222,OT,Positiv Strong Virtue,NW
2223,OT,ABS DIST Space TimeSpc,NW
2224,OT,Active Travel TranLwCausal IfMeans WltOth WltTotSpaceVirtue SklOth SklTOTStrong Active Exert IAV,NW
2225,OT,Positiv Pstv Strong Virtue PosAffNatrProStrong Active Rise IAVQuality,NW
2226,OT,Solve IAVMilit Object ToolPassive Goal EnlOth EnlTotSpacePositiv Nonadlt IndAdj,NW
2227,OT,ComForm DAV EnlGain EnlTot,NW
2228,OT,Positiv NatrPro Know IndAdjABS DIST Space TimeSpcPower Active TravelFinishPLACE Route,NW
2229,OT,Strong QualityEcon@ ECON Rel PowOth PowTotStrong Power Active WorkPositiv Affil Strong IndAdjSpaceQuan,NW
2230,OT,Hostile Role HU PowPt PowTotStay IAV EnlGain EnlTotQuanPositiv Affil Strong IndAdj,NW
2231,OT,Strong Active Ovrst PersistPositiv Pstv Strong Active Virtue TrnGainSpace,NW
2232,OT,Econ@ Means SklOth SklTOT,NW
2233,OT,Positiv Affil Strong IndAdjStrong Ovrst Know EVAL SureLwPositiv Pstv FinishStrong Active Work IAV TrnGain,NW
2234,OT,RitualSpace TimeSpcEcon@ ECON COLL HU WltPt WltTot,NW
2235,OT,Undrst EndsLwActive Exert Abs@ ABS EndsLwSpace TimeSpc,NW
2236,OT,Weak Time@ TimeSpcRitualNegativ Ngtv Role HU,NW
2237,OT,Negativ Ngtv Weak Passive Vice EndsLwKnowHostile SocRelArousal EndsLw,NW
2238,OT,Positiv Feel Arousal DoctrinPositiv Pstv Virtue EndsLw,NW
2239,OT,SpacePLACE LandSpaceSpace TimeSpc,NW
2240,OT,Negativ Ngtv Passive Need EndsLwBodyPtComForm COM PowOth PowTot FormLwNegativ Ngtv Strong Active Finish PowLoss PowTot,NW
2241,OT,Power ComForm COM FormLwABS DIST Space TimeSpc,NW
2242,EDGE,Strong Virtue EndsLwPositiv Nonadlt IndAdjCausal EndsLwSpace TimeSpc,NW
2243,EDGE,NatrProPositiv Nonadlt IndAdj,NW
2244,EDGE,Ovrst QuanStrong Ovrst Quan SureLwStrong Quan DIM,NW
2245,EDGE,Strong EVAL QualityStrong Active Fetch DAV TranLwNegativ Ngtv Hostile POLIT Role HU PowCon PowTot,NW
2246,EDGE,Passive ArousalSubmit Passive ComForm TranLwPositiv Nonadlt IndAdjPower ComForm EnlGain EnlTot,NW
2247,EDGE,Positiv Pstv Strong Virtue EVAL SklOth SklTOTNatrPro,NW
2248,EDGE,ABS DIST Space TimeSpcPositiv Pstv Strong Active Exprsv Begin IAV EndsLwRitual,NW
2249,EDGE,Strong Means MeansLwPositiv Pstv Strong Virtue Ovrst EVAL RspOth RspTotActive Travel TranLw,NW
2250,EDGE,Active Travel TranLwKnow WlbPsyc WlbTot,NW
2251,EDGE,Positiv Pstv Strong Virtue EndsLwActive Exert Abs@ ABS EndsLwPositiv Pstv Virtue Econ@ ECON WltOth WltTot,NW
2252,EDGE,Academ Doctrin EnlOth EnlTotNegativ Ngtv Hostile POLIT Role HU PowCon PowTot,NW
2253,EDGE,Negativ Ngtv Weak Passive Vice EndsLwPositiv Pstv Strong Virtue Ovrst EVAL RspOth RspTotStrong Active Fall IAV,NW
2254,EDGE,BodyPtPower ComForm EnlGain EnlTot,NW
2255,EDGE,Positiv Econ@ Quan WltOth WltTotABS DIST Space TimeSpcSpace,NW
2256,EDGE,Positiv Pstv Active ComForm DAV EnlGain EnlTotPositiv Pstv Affil Strong Active Role HU,NW
2257,EDGE,,NW
2258,EDGE,Negativ Ngtv Weak Passive Vice EndsLwPositiv Strong VirtueStrong Active Increas TimeSpcRitual,NW
2259,EDGE,Strong Stay IAVStrong Ovrst Time@ Intrj SureLwActive Travel TranLw,NW
2260,EDGE,Causal IfPositiv Pstv Strong Virtue EndsLwStrong Power Econ@ Role HU WltPt WltTotStrong ComForm EnlOth EnlTot FormLwHostile Role HU PowPt PowTot,NW
2261,WR,,NW
2262,WR,Positiv Pstv Strong Virtue ExprsvOvrst QuanQualityStrong Power Econ@ Role HU WltPt WltTot,NW
2263,WR,Positiv Pstv Passive VirtueRitualPassive Quan TimeSpcPositiv Nonadlt IndAdj,NW
2264,WR,Legal Role HU SklPt SklTOTPositiv Pstv Strong Active Virtue SklOth SklTOTNegativ ComForm PerceivEcon@ ECON ComForm COM FormLwActive Travel IAV TranLwGoal Abs@ ABS EndsLw,NW
2265,WR,Positiv Pstv Strong Active Exprsv Begin IAV EndsLwPositiv Pstv Affil Strong Active Role HU,NW
2266,WR,Strong Active Increas TimeSpc,NW
2267,WR,Positiv NatrPro Know IndAdjStrong Space,NW
2268,WR,Strong Power Active ComForm IAV EnlOth EnlTotPassive Goal EnlOth EnlTot,NW
2269,WR,Positiv Pleasur EMOT UndrstStrong Active Complet IAV TrnGain,NW
2270,WR,Passive Arousal EMOTPositiv Pstv Affil Strong Active Role HUSpaceBodyPtStrong Active Increas IAV EndsLwECON Exprsv Ritual,NW
2271,WR,Strong Work DAV PowOth PowTotStrong Active Ovrst PersistPositiv Pstv Active ComForm DAV EnlGain EnlTotSpaceStrong Active Complet IAV TrnGain,NW
2272,WR,Positiv Nonadlt IndAdjNegativ Ngtv Passive Need EndsLwAcadem Doctrin EnlOth EnlTot,NW
2273,WR,Strong Means EndsLwSpace,NW
2274,WR,Strong Active Exert IAV TranLw,NW
2275,WR,Solve IAV,NW
2276,WR,Finish IAVPositiv Pstv Strong Virtue ExprsvSpace TimeSpcAbs@ ABS Time@,NW
2277,WR,Solve IAVStrong Active Fall IAVNegativ Ngtv Weak Passive Fail IAV PowCon PowTot,NW
2278,WR,Passive Travel IAV,NW
2279,WR,Negativ Ngtv Weak Passive Vice EndsLwRitualPassive Goal EnlOth EnlTotObject Tool,NW
2280,WR,,NW
2281,LB,,NW
2282,LB,Positiv Nonadlt IndAdjSpace TimeSpcNegativ Ngtv Hostile Weak Passive SocRel PowCon PowTotMeans WltOth WltTot,NW
2283,LB,Space TimeSpcPositiv Nonadlt IndAdj,NW
2284,LB,NatrPro,NW
2285,LB,Strong Power Active WorkObject BldgPt TimeSpcPositiv Nonadlt IndAdj,NW
2286,LB,Strong Active Fetch IAV TrnGainStrong Active Rise IAV,NW
2287,LB,Strong Active Exert IAVStrong Milit Role HU PowAuPt PowTotNegativ Ngtv Weak Passive Vice Abs@ ABS WltTran WltTot,NW
2288,LB,Finish,NW
2289,LB,Finish,NW
2290,LB,SpaceAcadem PLACE Social EnlOth EnlTot,NW
2291,LB,Positiv Role HU KnowActive Exert Abs@ ABS EndsLw,NW
2292,LB,Negativ OvrstKnow EnlGain EnlTotPositiv Nonadlt IndAdjStrong Active Increas EndsLw,NW
2293,LB,Active TravelNegativ Ngtv Role HU,NW
2294,LB,Strong Active Rise IAV,NW
2295,LB,Positiv Econ@ Quan WltOth WltTotHostile ComForm PowCon PowTot FormLwPositiv Nonadlt IndAdj,NW
2296,LB,Negativ Ngtv Passive Need EndsLwPositiv Nonadlt IndAdj,NW
2297,LB,Negativ Weak Active Travel IAVABS DIST Space TimeSpcPower ComForm EnlGain EnlTot,NW
2298,LB,Positiv Nonadlt IndAdjSpacePositiv Pstv Strong Virtue EndsLwOvrst Know,NW
2299,LB,Positiv Eval@ Quality IndAdjStrong Work DAV PowOth PowTotRitual,NW
2300,C,Strong Ovrst Time@ Intrj SureLw,W
2301,C,Weak Submit Passive Rel DAVStrong Active Fetch DAV TranLwNegativ Ngtv Hostile POLIT Role HU PowCon PowTot,W
2302,C,BodyPt WlbPhys WlbTotPower Active Travel,W
2303,C,QualityStrong Active Rise IAVStrong Power Econ@ Role HU WltPt WltTotStrong Solve IAV,W
2304,C,NatrProPositiv Pstv Passive VirtueStrong Active Exert IAV,W
2305,C,Positiv Pstv Virtue EVAL PosAffPositiv Feel Arousal DoctrinSpaceStrong Quan,W
2306,C,ABS DIST Space TimeSpcActive Travel TranLwPositiv Pstv Active ComForm DAV EnlGain EnlTot,W
2307,C,Passive Goal EnlOth EnlTotPositiv Affil Strong IndAdj,W
2308,C,BodyPt WlbPhys WlbTotBodyPtStrong Stay IAV,W
2309,C,Positiv Affil Strong IndAdj,W
2310,C,Strong Space IAV PosAffWeak Space DIM,W
2311,C,Passive Goal EnlOth EnlTot,W
2312,C,Negativ Ngtv Strong Active NatrPro PowOth PowTotPositiv Strong NatrPro,W
2313,C,Strong ComForm EnlOth EnlTot FormLwHostile Role HU PowPt PowTot,W
2314,C,Object ToolStrong Quan DIM,W
2315,C,Negativ Ngtv Hostile POLIT Role HU PowCon PowTotStrong Ovrst Quan SureLwStrong Active Exert IAV TranLwObject ComnObj,W
2316,LB,Positiv Pstv Virtue EVAL PosAffPositiv Pstv Doctrin RcEthic RcTotPositiv Pstv Strong Power Active Goal EndsLwStay IAV EnlGain EnlTotSpace,NW
2317,LB,Positiv Pstv Strong Virtue ExprsvActive Travel TranLw,NW
2318,LB,Positiv Nonadlt IndAdj,NW
2319,LB,Positiv Pstv Strong Virtue EVAL SklOth SklTOTNegativ Ngtv Strong Active NatrPro PowOth PowTotStrong Active Fall IAV,NW
2320,LB,Positiv Eval@ Quality IndAdjActive Travel IAV TranLwOvrst Quan,NW
2321,LB,Positiv Strong VirtuePower ComForm EnlGain EnlTotActive Travel EndsLw,NW
2322,LB,Arousal EndsLwNegativ Ngtv Hostile Strong Active SocRel IAV PowLoss PowTotSpace TimeSpc,NW
2323,LB,Positiv Pstv Strong Power Virtue MeansLwPositiv Nonadlt IndAdj,NW
2324,LB,Object ToolPositiv Ovrst Know IndAdjStrong Active Increas TimeSpcNegativ Ngtv Vice Ovrst EVAL NegAff,NW
2325,LB,Strong Active Complet IAV TrnGainMeans WltOth WltTotEcon@ ECON ComForm COM FormLw,NW
2326,LB,Positiv NatrPro Know IndAdjNegativ Hostile Active IPadjNegativ Ngtv Weak Active Fail DAV,NW
2327,LB,FinishAcadem PLACE Social EnlOth EnlTotNegativ Ngtv Hostile Weak Passive SocRel PowCon PowTotStrong Rel IAV TranLwEcon@ Means SklOth SklTOT,NW
2328,LB,Positiv Nonadlt IndAdjQuality,NW
2329,LB,Passive PerceivSpace TimeSpc,NW
2330,LB,Positiv Nonadlt IndAdjNegativ Ngtv Vice EnlOth EnlTotNegativ Ngtv Vice Ovrst EVAL NegAff,NW
2331,LB,Negativ Ngtv Weak Passive Vice EndsLwStrong Ovrst Means EndsLwPositiv Active ComForm Solve IAV,NW
2332,LB,Active Travel EndsLwWeak Undrst FREQ TimeSpcNegativ Passive Increas IAV,NW
2333,LB,Negativ Ngtv Passive Need EndsLwNegativ Ngtv Hostile Strong Active Vice PowCon PowTotSpace,NW
2334,LB,Negativ Ngtv Role HU,NW
2335,LB,Negativ OvrstPassive Goal EndsLw,NW
2336,EDGE,Positiv Pstv Rel IAV RspGain RspTotHostile Strong Power Active Milit SocRel IAV PowCon PowTot,NW
2337,EDGE,Positiv Pstv Virtue EVAL SklOth SklTOTECON POLIT Name,NW
2338,EDGE,Active Vary IAV,NW
2339,EDGE,,NW
2340,EDGE,Positiv Pstv Strong Virtue Ovrst EVAL RspOth RspTot,NW
2341,EDGE,Space DIM TimeSpcPositiv Pstv Strong Ovrst Quan,NW
2342,EDGE,Positiv Pstv Strong Virtue EVAL SklOth SklTOTStrong Ovrst Time@ Intrj SureLwObject Tool,NW
2343,EDGE,Negativ Hostile Active Exert IAVStrong Active Fetch DAV TranLwStrong ComForm EnlOth EnlTot FormLwHostile Role HU PowPt PowTot,NW
2344,EDGE,Positiv Nonadlt IndAdjNegativ Ngtv Hostile Power Passive Vice PowOth PowTot,NW
2345,EDGE,Passive PerceivPositiv Pstv Affil Active Virtue EVAL MeansLwCausal,NW
2346,EDGE,Hostile Strong Active Stay IAV PowCon PowTot,NW
2347,EDGE,Strong Active Exert IAV TranLwActive Exert DAV,NW
2348,EDGE,Means WltOth WltTotSpace,NW
2349,EDGE,Positiv Pstv Active ComForm DAV EnlGain EnlTotStrong Work DAV PowOth PowTotPositiv Pstv Strong Active Virtue SklOth SklTOTPositiv Pstv Active ComForm DAV EnlGain EnlTot,NW
2350,EDGE,Negativ Ngtv Hostile Active Virtue PowCon PowTotQuality,NW
2351,EDGE,,NW
2352,EDGE,Negativ Ngtv Weak Passive Vice SklOth SklTOTPositiv Pstv Virtue EVAL WltOth WltTotNegativ Ngtv Hostile Strong Active SocRel IAV PowLoss PowTot,NW
2353,EDGE,Negativ Ngtv Passive Need EndsLwPositiv Pstv Ovrst RelHostile Role HU PowPt PowTot,NW
2354,DT,Positiv Nonadlt IndAdjSpace TimeSpc,NW
2355,DT,Positiv Pstv Strong Virtue EndsLw,NW
2356,DT,Space,NW
2357,DT,ABS DIST Space TimeSpcStrong Stay IAVStrong Quan,NW
2358,DT,Positiv Pstv Affil Active Virtue EVAL MeansLwPLACE RouteStrong Space IAV PosAff,NW
2359,DT,Positiv Pstv Virtue Undrst EVAL EndsLw,NW
2360,DT,Positiv Pstv Strong Active Virtue TrnGainPositiv Strong Virtue EVAL Abs@ ABS MeansLw,NW
2361,DT,Hostile Strong Power Active Milit SocRel IAV PowCon PowTotNegativ Ngtv Hostile Strong Active SocRel IAV PowLoss PowTotObject Tool,NW
2362,DT,Passive Perceiv IAV EnlOth EnlTotStrong Active Increas EndsLwStrong Quan,NW
2363,DT,Causal IfStrong NatrPro WltOth WltTotPositiv Pstv Active Passive Means EnlOth EnlTot,NW
2364,DT,RitualSpace TimeSpcObject Tool,NW
2365,DT,Object ToolPositiv Affil Strong IndAdj,NW
2366,DT,Virtue Ovrst EVALHostile Strong Power Active Milit SocRel IAV PowCon PowTotStrong Ovrst Space DIM SureLwStrong ComForm EnlOth EnlTot FormLwHostile Role HU PowPt PowTot,NW
2367,DT,QualityABS DIST Space TimeSpcCausalNegativ OvrstStrong Solve IAV,NW
2368,DT,Strong Active Travel PowPt PowTot TranLwStrong Power Econ@ Role HU WltPt WltTotPositiv Pstv Strong Virtue EVAL SklOth SklTOTNegativ Ngtv Passive Need EndsLw,NW
2369,DT,Positiv Pstv Strong Active Virtue TrnGainPositiv Pstv Strong Active Virtue TrnGainStrong Power Econ@ Role HU WltPt WltTotSubmit Passive SocRel IAV TranLw,NW
2370,EDGE,Active Causal TrnGainActive Causal TrnGain,NW
2371,EDGE,,NW
2372,EDGE,Negativ Ngtv Role HU,NW
2373,EDGE,Positiv Pstv Strong Active Exprsv Begin IAV EndsLwNegativ Vice OvrstSpaceSpace TimeSpc,NW
2374,EDGE,QualityNegativ Ngtv Strong Active NatrPro PowOth PowTotWork IAV,NW
2375,EDGE,Object ToolHostile ComForm PowCon PowTot FormLw,NW
2376,EDGE,Arousal EndsLwSpace TimeSpc,NW
2377,EDGE,Negativ Hostile Active Exert IAVPositiv Complet QuanStrong Ovrst Space DIM SureLwPositiv Pstv Active Work IAV,NW
2378,EDGE,Hostile Strong Active Space PowOth PowTot,NW
2379,EDGE,Strong Active Fall IAVActive TravelPositiv Nonadlt IndAdj,NW
2380,EDGE,Affil Strong Role Kin@ MALE HU AffPt AffTotECON Exprsv RitualAffil Active Academ SocRel IAV,NW
2381,EDGE,Negativ Ngtv Weak Passive Vice EndsLw,NW
2382,EDGE,BodyPtNegativ Ngtv Weak Passive Vice EndsLwECON POLIT NameBodyPt WlbPhys WlbTot,NW
2383,EDGE,Positiv Nonadlt IndAdjWeak Space DIMStrong Solve IAVPositiv Pstv Affil Arousal EMOT AffOth AffTotPositiv Pstv Active ComForm DAV EnlGain EnlTotStrong Work DAV PowOth PowTot,NW
2384,EDGE,Hostile Vice Legal RcEthic RcTot,NW
2385,EDGE,Negativ Hostile Active Exert IAVStrong Means MeansLw,NW
2386,EDGE,Negativ Ngtv Passive Need EndsLwIAV RcEthic RcTot,NW
