ID,Position,Scouting Report Sentence(s),Race
3465,WR,ECON Exprsv Ritual,NW
3466,WR,Positiv Pstv FinishStrong Active Complet IAV TrnGain,NW
3467,WR,Strong Quality TimeSpcStrong Active Complet IAV TrnGain,NW
3468,WR,Positiv Strong Virtue EVAL Abs@ ABS MeansLw,NW
3469,WR,Strong Active Complet IAV TrnGain,NW
3470,WR,Virtue SklOth SklTOTNegativ Ngtv Vice EnlOth EnlTotStrong Active Travel PowPt PowTot TranLw,NW
3471,WR,Passive Arousal EndsLwSolve IAVStrong Means EndsLw,NW
3472,WR,Power Active TravelObject ToolPositiv Pstv Virtue EVAL WltOth WltTotNegativ Ngtv Weak Passive Pain EMOT Anomie,NW
3473,WR,Negativ Eval@ Quality IndAdjNegativ Ngtv Weak Passive Vice EndsLw,NW
3474,WR,Solve IAVStrong Active Fall IAV,NW
3475,WR,Submit Active ComForm DAV AffGain AffTotPositiv Pstv Ovrst Rel,NW
3476,WR,Negativ Ngtv Weak Active Fail DAVPositiv Pstv Virtue EVALStrong Active Complet IAV TrnGainMeans WltOth WltTot,NW
3477,DE,ECON POLIT NameStrong BodyPt PowOth PowTotActive Travel DAVSpaceAcadem PLACE Social EnlOth EnlTot,NW
3478,DE,Positiv Nonadlt IndAdjPositiv Pstv Virtue Econ@ ECON WltOth WltTotPositiv Pstv Strong Active Virtue TrnGain,NW
3479,DE,Hostile Strong Power Active Milit SocRel IAV PowCon PowTotStrong Ovrst Quan SureLwNegativ Ngtv Know PowOth PowTot,NW
3480,DE,Negativ Hostile Active Exert IAV,NW
3481,DE,Negativ Hostile Active Exert IAVPassive Quan TimeSpcHostile Strong Active Stay IAV PowCon PowTotStrong ComForm EnlOth EnlTot FormLwHostile Role HU PowPt PowTot,NW
3482,DE,Strong Virtue EndsLwABS Time@ TIME EndsLw,NW
3483,DE,Strong Stay IAVPositiv Pstv Virtue EVAL WltOth WltTotStrong Increas,NW
3484,DE,Space TimeSpcHostile Role HU PowPt PowTotSpace TimeSpc,NW
3485,DE,QualityPositiv Pstv Strong Active Exprsv Begin IAV EndsLwSpace ArenaLw,NW
3486,DE,Quan,NW
3487,DE,Negativ Ngtv Weak Passive Vice Negate MeansLwWeak Submit Passive Rel DAVNegativ Ngtv Weak Active Fail DAVStrong Power NatrProStrong Stay IAVPositiv Pstv Strong Virtue EndsLw,NW
3488,DE,,NW
3489,DE,ComForm DAV EnlGain EnlTotPositiv NatrPro Know IndAdjSpaceStrong Ovrst SureLw,NW
3490,DE,Negativ Ngtv Weak Passive Vice EndsLwKnowPositiv Strong VirtuePower ComForm EnlGain EnlTot,NW
3491,DE,Negativ Weak Active Travel IAVABS DIST Space TimeSpcHostile Role HU PowPt PowTot,NW
3492,DE,ComForm COM PowOth PowTot FormLw,NW
3493,DE,Positiv Pleasur EMOT StayNegativ Ngtv Hostile Strong Active SocRel IAV PowLoss PowTot,NW
3494,CB,Positiv Pstv Strong Virtue Ovrst EVAL RspOth RspTot,NW
3495,CB,,NW
3496,CB,Strong Active Complet IAV PowGain PowTotSubmit Passive Role HUActive Work IAVPositiv Role HU Know,NW
3497,CB,Positiv Pstv Virtue Econ@ ECON WltOth WltTotSpace TimeSpc,NW
3498,CB,Positiv Pstv Strong Virtue Exprsv,NW
3499,CB,NatrProStrong Active Travel PowPt PowTot TranLwNegativ Ngtv Weak Vice ECON WltOth WltTotTravel IAV,NW
3500,CB,Negativ Ngtv Hostile Strong ANIVirtue Ovrst EVALPositiv Pstv Virtue Econ@ ECON WltOth WltTot,NW
3501,CB,Academ PLACE Social EnlOth EnlTotNegativ Ngtv Hostile Strong Active SocRel IAV TrnLoss,NW
3502,CB,Positiv Pstv Strong Virtue PosAffStrong Active Begin EndsLw,NW
3503,CB,Power ComForm EnlGain EnlTotNegativ Ngtv Hostile Strong Active SocRel IAV TrnLoss,NW
3504,CB,Weak Submit Passive Rel DAVSpace TimeSpcNegativ Ngtv Hostile Strong Active SocRel IAV TrnLoss,NW
3505,CB,Solve IAVStrong Ovrst Quan SureLwSpace TimeSpc,NW
3506,CB,Object ToolSpaceActive Travel IAV TranLwGoal Abs@ ABS EndsLw,NW
3507,CB,Econ@ ECON ComForm COM FormLw,NW
3508,CB,Positiv Pstv Virtue Econ@ ECON WltOth WltTot,NW
3509,CB,Positiv Pstv Affil Strong Active Role HU,NW
3510,CB,Academ PLACE Social EnlOth EnlTotActive Academ Try IAV EnlEnds EnlTotSubmit Passive Role HU,NW
3511,FB,Causal If,W
3512,FB,Affil Active Academ SocRel IAVSubmit Active ComForm DAV AffGain AffTot,W
3513,FB,,W
3514,FB,Strong Active Complet IAV TrnGainSpace,W
3515,FB,Positiv Pstv Virtue EVAL PosAffPositiv Pstv Strong Virtue ExprsvPositiv Strong Virtue EVAL Abs@ ABS MeansLwVary TranLwPositiv Pstv Passive Virtue,W
3516,FB,Active Exert Abs@ ABS EndsLw,W
3517,FB,,W
3518,FB,Negativ Ngtv Passive Need EndsLwIAV RcEthic RcTotEcon@ ECON Means SklOth SklTOTCOLL HU,W
3519,FB,SpaceNegativ Ngtv Passive Need EndsLwPositiv Pstv Strong Active Virtue TrnGain,W
3520,FB,Strong Space IAV PosAffPositiv Pstv Strong Active Virtue SklOth SklTOTNegativ Ngtv Passive Need EndsLw,W
3521,FB,Econ@ Means SklOth SklTOTStrong Active Complet IAV TrnGain,W
3522,FB,Submit Active ComForm DAV AffGain AffTotPositiv Affil Strong IndAdj,W
3523,LB,Strong Quan DIMPositiv Role HU Know,W
3524,LB,Strong Active Exert Abs@ ABS TranLw,W
3525,LB,Negativ Ngtv Weak Active Fail DAV,W
3526,LB,ComForm DAV EnlGain EnlTotHostile SocRel,W
3527,LB,Negativ Hostile Active Exert IAV,W
3528,LB,Negativ Ngtv Weak Passive Vice Abs@ ABS WltTran WltTotStrong SpaceSpace TimeSpc,W
3529,LB,Finish,W
3530,LB,,W
3531,LB,Negativ Ngtv Passive Need EndsLwECON POLIT NameSpaceBodyPt WlbPhys WlbTot,W
3532,LB,Perceiv EnlOth EnlTotNegativ Ngtv Passive Need EndsLw,W
3533,LB,Legal Role HU SklPt SklTOTStrong Active Exert IAVPositiv Feel Arousal Doctrin,W
3534,LB,Positiv Eval@ Quality IndAdjFinish,W
3535,LB,Positiv Pstv Virtue Econ@ ECON WltOth WltTotEcon@ ECON ComForm COM FormLw,W
3536,LB,Positiv Pstv Strong Passive Perceiv Abs@ ABS EnlOth EnlTotNatrPro,W
3537,SAF,Strong Power Active POLIT Role HU PowPt PowTotComForm IAV RspOth RspTotNegativ Vice,NW
3538,SAF,ECON Exprsv RitualExprsv Role HU PtLw,NW
3539,SAF,Negativ Ngtv Hostile Weak Vice WlbPhys WlbTot,NW
3540,SAF,,NW
3541,SAF,Time@ TimeSpcStrong Quan,NW
3542,SAF,Strong Quality,NW
3543,SAF,Strong Active Try Means IAVQualityActive Travel IAV TranLw,NW
3544,SAF,Hostile Role HU PowPt PowTotPower ComForm COM FormLw,NW
3545,SAF,Strong Ovrst Quan SureLwHostile Strong Power Active ComForm IAV PowCon PowTotMeans WltOth WltTot,NW
3546,SAF,Space TimeSpc,NW
3547,SAF,,NW
3548,SAF,Negativ Ngtv Passive Need EndsLwPositiv Nonadlt IndAdjSpaceABS DIST Space TimeSpcPositiv Pstv Strong Active Virtue TrnGainRitual,NW
3549,SAF,Negativ OvrstPLACE LandHostile ComForm PowCon PowTot FormLwNegativ Weak Pain EMOT SocRel IPadj,NW
3550,SAF,Positiv Econ@ Quan WltOth WltTotNegativ Ngtv Weak Passive Fail IAV PowCon PowTotStrong Ovrst Time@ Intrj SureLw,NW
3551,SAF,Econ@ ECON ComForm COM FormLwPassive Virtue RcEnds RcTotPositiv NatrPro Know IndAdjSolve IAV,NW
3552,SAF,Travel IAVSpace,NW
3553,SAF,Negativ Ngtv Passive Need EndsLwNegativ Ngtv Weak Passive Fail IAV PowCon PowTotSpace,NW
3554,SAF,Econ@ ECON ComForm COM FormLwPositiv Pstv Strong Passive Perceiv Abs@ ABS EnlOth EnlTotPositiv Nonadlt IndAdjStrong Space,NW
3555,WR,Positiv Pstv Strong Virtue Ovrst EVAL RspOth RspTotStrong Space,NW
3556,WR,Solve IAVStrong Active Complet IAV TrnGain,NW
3557,WR,QuanStrong Active Complet IAV TrnGain,NW
3558,WR,Negativ Strong Power Active IAVActive ECON Means,NW
3559,WR,BodyPt WlbPhys WlbTotPositiv Pstv Affil Active Virtue EVAL MeansLwPositiv Nonadlt IndAdjStrong EVAL Quality,NW
3560,WR,Space,NW
3561,WR,SpaceStrong Space,NW
3562,WR,SpaceQuality,NW
3563,WR,Strong Active Complet IAV TrnGain,NW
3564,WR,Space TimeSpc,NW
3565,WR,QualityExprsv Role HU SklPt SklTOT,NW
3566,WR,Active Causal TrnGainNegativ Ngtv Weak Passive Fail IAV PowCon PowTot,NW
3567,WR,Negativ Ngtv Weak Active Fail DAVActive Solve IAV EnlGain EnlTotPositiv Pstv Affil Arousal EMOT AffOth AffTotSpaceQuality,NW
3568,WR,Negativ Ngtv Role HU,NW
3569,WR,QualityStrong Active Complet IAV TrnGain,NW
3570,WR,Know EndsLwNegativ Ngtv Vice Ovrst EVAL NegAff,NW
3571,WR,Negativ Ngtv Weak Passive Vice EndsLwPassive Arousal EMOTActive Travel IAV TranLwPOLIT Space TimeSpcNegativ Ngtv Hostile Active Exert DAVABS DIST Space TimeSpcPositiv Pstv Strong Virtue EndsLw,NW
3572,WR,Negativ Ngtv Passive Need EndsLwIAV RcEthic RcTotPositiv Affil Strong IndAdjStrong Active Complet IAV TrnGain,NW
3573,SAF,Strong BodyPt PowOth PowTot,NW
3574,SAF,Positiv Pstv Affil Strong ECON POLIT COLL HU PowAren PowTot,NW
3575,SAF,Positiv Nonadlt IndAdjNegativ Ngtv Hostile Active Virtue PowCon PowTotNatrProSpace,NW
3576,SAF,Positiv Nonadlt IndAdjSubmit Passive Role HU,NW
3577,SAF,Positiv Pstv Strong Ovrst QuanPLACE Region TimeSpc,NW
3578,SAF,QualitySpaceSpace,NW
3579,SAF,BodyPt,NW
3580,SAF,Negativ Ngtv Weak Submit Passive Vice PowCon PowTotNegativ Ngtv Hostile Strong Active Vice Eval@ IndAdjSpacePositiv Eval@ Quality IndAdj,NW
3581,SAF,Positiv Pstv Virtue EVALEcon@ ECON Means SklOth SklTOT,NW
3582,SAF,Strong Active Travel PowPt PowTot TranLwNegativ Work Fail Stay,NW
3583,SAF,BodyPt,NW
3584,SAF,Econ@ ECON ComForm COM FormLw,NW
3585,SAF,ABS DIST Space TimeSpc,NW
3586,SAF,Solve IAVStrong ComForm EnlOth EnlTot FormLwHostile Role HU PowPt PowTotStrong Space,NW
3587,SAF,,NW
3588,SAF,Negativ Ngtv Weak Passive Vice EndsLwStrong Ovrst Quan SureLwPositiv Pstv Strong Virtue EndsLw,NW
3589,SAF,Active Travel IAV TranLw,NW
3590,DT,Strong Power Active Means,NW
3591,DT,BodyPt WlbPhys WlbTotQuan,NW
3592,DT,Passive Undrst Know RspOth RspTotPositiv Causal IndAdj,NW
3593,DT,Strong Solve IAVPositiv Pstv Virtue EVAL PosAffABS DIST Space TimeSpc,NW
3594,DT,Passive PerceivPositiv Nonadlt IndAdj,NW
3595,DT,,NW
3596,DT,Hostile SocRelABS DIST SpaceMeans EndsLw,NW
3597,DT,QualityComForm COM PowOth PowTot FormLwSpace TimeSpc,NW
3598,DT,Negativ Active Try IAV,NW
3599,DT,Negativ Ngtv Strong Active NatrPro PowOth PowTotStrong Active Exert IAVStrong Work DAV PowOth PowTot,NW
3600,DT,Positiv Pstv Strong Active Virtue TrnGain,NW
3601,DT,Active Travel TranLwPositiv Know PerceivSpace TimeSpcPositiv Strong IncreasObject Tool,NW
3602,DT,Positiv Pstv Virtue EndsLw,NW
3603,DT,Solve IAV,NW
3604,DT,Negativ Ngtv Weak Passive Vice EndsLwStrong Stay IAV,NW
3605,DT,Passive Arousal EMOTSolve IAV,NW
3606,DT,Positiv Econ@ Quan WltOth WltTotQualitySpaceComForm COM PowOth PowTot FormLw,NW
3607,DT,Active Work,NW
3608,DT,Negativ Ngtv Weak Passive Vice EndsLwPositiv Strong VirtueMeans EndsLw,NW
3609,C,Active Academ Try IAV EnlEnds EnlTotStrong Space IAV PosAffStrong Milit Role HU PowAuPt PowTot,NW
3610,C,ECON POLIT NamePositiv Pstv Strong Virtue MeansLwStrong ComForm EnlOth EnlTot FormLwHostile Role HU PowPt PowTot,NW
3611,C,Positiv Pstv Virtue Undrst EVAL EndsLw,NW
3612,C,Strong Milit Role HU PowAuPt PowTotSpace,NW
3613,C,Positiv Pstv Virtue EVAL WltOth WltTotStrong Power Econ@ Role HU WltPt WltTot,NW
3614,C,Positiv Pstv Virtue Undrst EVAL EndsLwStrong Quan DIM,NW
3615,C,Positiv Pstv Virtue EVAL RcEnds RcTotPositiv Pstv Passive Virtue,NW
3616,C,Strong ABS DIST SpaceQualityPositiv Affil Strong IndAdj,NW
3617,C,BodyPt WlbPhys WlbTotWeak Submit Passive Rel DAV,NW
3618,C,Means WltOth WltTotSpacePower Active Travel,NW
3619,C,Solve IAV,NW
3620,C,SpaceEcon@ ECON COLL HU WltPt WltTot,NW
3621,C,Strong Stay IAVStrong Power NatrProQualityNegativ Ngtv Role HU,NW
3622,C,Positiv Increas IndAdjStrong Active Complet IAV TrnGain,NW
3623,C,QualityStrong Power Econ@ Role HU WltPt WltTot,NW
3624,C,BodyPt WlbPhys WlbTot,NW
3625,DE,Positiv Pstv Virtue Undrst EVAL EndsLwHostile Strong Power Active Milit SocRel IAV PowCon PowTotStrong Ovrst Quan SureLw,NW
3626,DE,Strong ComForm EnlOth EnlTot FormLwHostile Role HU PowPt PowTot,NW
3627,DE,Active Econ@ Work IAVNegativ Ngtv Hostile POLIT Role HU PowCon PowTotNegativ Ngtv Weak Vice TrnLoss,NW
3628,DE,,NW
3629,DE,Strong Active Begin EndsLwStrong Active Travel PowPt PowTot TranLwNegativ Hostile Active Ovrst Econ@ ComForm IAV,NW
3630,DE,Strong Solve IAVPower Active TravelPositiv Pstv Active ComForm DAV EnlGain EnlTotSpace,NW
3631,DE,Positiv Pstv Virtue EVAL SklOth SklTOT,NW
3632,DE,Negativ Hostile VicePositiv Nonadlt IndAdj,NW
3633,DE,Negativ Ngtv Weak Submit Passive Vice PowCon PowTotMeans WltOth WltTotSpace TimeSpc,NW
3634,DE,Positiv Eval@ Quality IndAdjStrong Active Increas TimeSpc,NW
3635,DE,Negativ Active ComForm IAVNegativ Hostile Active Exert IAVObject BldgPt TimeSpc,NW
3636,DE,Positiv Eval@ Quality IndAdjActive Exert Abs@ ABS EndsLw,NW
3637,DE,Negativ Ngtv Strong Active NatrPro PowOth PowTotNegativ Strong Power Active IAV,NW
3638,DE,Active TravelPositiv Pstv Active ComForm DAV EnlGain EnlTotActive Exert Abs@ ABS EndsLw,NW
3639,DE,Positiv Strong VirtueVirtue Ovrst RcEnds RcTot FormLwBodyPtBodyPt WlbPhys WlbTotStrong Power NatrProPositiv Strong Virtue EVAL Abs@ ABS MeansLw,NW
3640,DE,Positiv Pstv Virtue EVALVirtue SklOth SklTOT,NW
3641,DE,Negativ Ngtv Weak Passive Vice EndsLwQuality,NW
3642,DE,Power ComForm EnlGain EnlTotActive Travel TranLw,NW
3643,DE,ComForm IAV RspOth RspTotPositiv Pstv Strong Virtue Exprsv,NW
3644,DE,Negativ Hostile Active Exert IAVMeans WltOth WltTot,NW
3645,DE,Strong Means MeansLwPositiv Pstv Strong Virtue EndsLwSpace TimeSpc,NW
3646,DT,Role HU WlbPt WlbTotBodyPt,NW
3647,DT,Strong Virtue EndsLwNegativ Passive Finish Exert IAVFinish IAVStrong Space IAV PosAff,NW
3648,DT,Negativ Hostile Active Exert IAVSubmit Passive SocRel IAV TranLw,NW
3649,DT,Strong Power Active ComForm IAV EnlOth EnlTotHostile ComForm PowCon PowTot FormLw,NW
3650,DT,Hostile Strong Power Active Milit SocRel IAV PowCon PowTotHostile SocRel,NW
3651,DT,Positiv Nonadlt IndAdjArousal EndsLw,NW
3652,DT,COLL HUStrong Work DAV PowOth PowTotUndrst EndsLwStrong Quan DIMPositiv Pstv Active ComForm DAV EnlGain EnlTot,NW
3653,DT,Hostile Strong Active Space PowOth PowTotStrong Virtue EndsLw,NW
3654,DT,QualityNegativ Ngtv Weak Passive Vice EndsLwQuanNegativ Ngtv Passive Need EndsLwActive Means,NW
3655,DT,Negativ Ngtv SpacePositiv Pstv Virtue Econ@ ECON WltOth WltTotABS Time@ TIME TimeSpc,NW
3656,DT,Positiv Nonadlt IndAdj,NW
3657,DT,ComForm IAV RspOth RspTotABS DIST Space,NW
3658,DT,Active Travel TranLwABS DIST Space TimeSpc,NW
3659,DT,Strong EVAL QualityABS DIST Space TimeSpcPositiv Pstv Strong Active Virtue SklOth SklTOT,NW
3660,DT,Econ@ ECON Rel PowOth PowTotStrong Power Active SocRel IAV PowOth PowTot,NW
3661,G,,NW
3662,G,Positiv Pstv Virtue Undrst EVAL EndsLwStrong Active Begin EndsLwNegativ Strong Power Active IAV,NW
3663,G,QualityPower Active TravelNegativ Ngtv Hostile Strong Active SocRel IAV PowLoss PowTotPositiv Pstv Affil Strong Active Role HU,NW
3664,G,Strong Active Solve IAV TranLwSpaceStrong Solve IAV,NW
3665,G,,NW
3666,G,Passive Virtue RcEnds RcTotABS DIST Space TimeSpc,NW
3667,G,,NW
3668,G,ABS DIST Space TimeSpc,NW
3669,G,Positiv Pstv Virtue Undrst EVAL EndsLwNegativ Hostile Active IPadjCOLL HUStrong Active Complet IAV TrnGainStrong Active Travel PowPt PowTot TranLw,NW
3670,G,Submit Passive Role HU,NW
3671,G,Hostile Strong Power Active Milit SocRel IAV PowCon PowTot,NW
3672,G,,NW
3673,G,BodyPt WlbPhys WlbTot,NW
3674,G,Strong Ovrst Quan SureLw,NW
3675,G,Negativ Ngtv Weak Passive Vice EndsLwKnowOvrst QuanNegativ Ngtv Role HU,NW
3676,G,Space TimeSpcSubmit Active ComForm DAV AffGain AffTotStrong Active Exert IAV,NW
3677,RB,Positiv Pstv Strong Virtue EndsLwPositiv Pstv Virtue Econ@ ECON WltOth WltTotUndrst EndsLw,NW
3678,RB,QualityQuality,NW
3679,RB,BodyPt WlbPhys WlbTotPositiv Nonadlt IndAdjHostile Strong Power Active Milit SocRel IAV PowCon PowTot,NW
3680,RB,QualityPositiv Pstv Active ComForm DAV EnlGain EnlTot,NW
3681,RB,IAV RcEthic RcTotNegativ Ngtv Hostile Power Passive Vice PowOth PowTot,NW
3682,RB,Positiv Pstv Virtue Undrst EVAL EndsLwPositiv Pstv Active ComForm DAV EnlGain EnlTotStrong Work DAV PowOth PowTotPassive Quan TimeSpc,NW
3683,RB,KnowStrong Active Complet IAV TrnGainPositiv Feel IndAdj,NW
3684,RB,Perceiv EnlOth EnlTotObject Tool,NW
3685,RB,Negativ Ngtv Weak Passive Vice EndsLwObject FoodSpace TimeSpc,NW
3686,RB,BodyPtStrong Power Causal PowLoss PowTot,NW
3687,RB,Strong Active Increas TimeSpcVirtue SklOth SklTOT,NW
3688,RB,Negativ Ngtv Weak Passive Vice EndsLwPositiv Pstv Active Virtue Abs@ ABS EndsLw,NW
3689,RB,Know EnlOth EnlTot,NW
3690,RB,Active Academ Try IAV EnlEnds EnlTot,NW
3691,DT,Ovrst Quan,NW
3692,DT,Affil Active Academ SocRel IAV,NW
3693,DT,Strong Quan DIMNatrPro IAV,NW
3694,DT,Positiv Pstv Virtue EVAL PosAffQuality,NW
3695,DT,Strong Active Fetch DAV TranLwStrong Power Econ@ Role HU WltPt WltTot,NW
3696,DT,,NW
3697,DT,Positiv Know Perceiv,NW
3698,DT,,NW
3699,DT,Strong EVAL QualityPositiv Pstv Strong Active Virtue SklOth SklTOT,NW
3700,DT,Strong Active Exert IAV TranLwNegativ Strong Power Active IAV,NW
3701,DT,Positiv Pstv Strong Active Exprsv Begin IAV EndsLw,NW
3702,DT,Positiv Pstv Virtue EVALABS DIST SpaceStrong Space IAV PosAff,NW
3703,DT,Hostile Role HU PowPt PowTot,NW
3704,DT,Negativ Ngtv Vice EnlOth EnlTotSpaceVirtue Ovrst RcEnds RcTot FormLwStrong Ovrst Quan SureLw,NW
3705,DT,Solve IAVStrong Active Fall IAV,NW
3706,DT,Negativ Ngtv Passive Need EndsLwActive Travel TranLwPositiv Role HU Know,NW
3707,RB,Quan,NW
3708,RB,Positiv Pstv Strong Power Virtue MeansLwStrong Power Active WorkSpace TimeSpcNegativ Ngtv Role HU,NW
3709,RB,Negativ Ngtv Role HUSpace TimeSpc,NW
3710,RB,ABS DIST Space TimeSpcPositiv Pstv Affil Active Virtue EVAL MeansLwCOLL HUVirtue SklOth SklTOTSpaceNegativ Ngtv Role HU,NW
3711,RB,Virtue SklOth SklTOTPositiv Strong Virtue EVAL Abs@ ABS MeansLwPositiv Pstv Affil SocRel IAV AffGain AffTot,NW
3712,RB,Strong Power Active Pleasur SureLw,NW
3713,RB,Positiv Pstv Active ComForm DAV EnlGain EnlTot,NW
3714,RB,QualityVirtue SklOth SklTOTPositiv Strong Virtue EVAL Abs@ ABS MeansLw,NW
3715,RB,Strong QualityNegativ Ngtv Weak Passive Vice EndsLw,NW
3716,RB,Positiv Pstv Strong Goal MeansLwIAV RcEthic RcTotPositiv Nonadlt IndAdjSpace,NW
3717,RB,Passive Arousal EMOTSolve IAV,NW
3718,RB,Negativ Ngtv Weak Passive Vice EndsLwPLACE Region TimeSpcStrong Active Fall IAVWork IAVQuality,NW
3719,RB,Solve IAVStrong Work DAV PowOth PowTotPositiv Pstv Active ComForm DAV EnlGain EnlTot,NW
3720,RB,Negativ Ngtv Weak Passive Persist IAV TranLwStrong Active Complet IAV TrnGain,NW
3721,RB,Negativ Ngtv Weak Vice Undrst IfActive Exprsv ComForm PowOth PowTot,NW
3722,OT,QualityBodyPtOvrst Quan,NW
3723,OT,ABS DIST Space TimeSpcPositiv Strong NatrProBodyPt,NW
3724,OT,Strong Active Increas TimeSpcABS DIST Space TimeSpcPositiv Pstv Active ComForm DAV EnlGain EnlTotPower Active Travel,NW
3725,OT,Positiv Feel Arousal Doctrin,NW
3726,OT,Abs@ ABS Time@Abs@ ABS Time@,NW
3727,OT,Negativ Hostile Active Exert IAVNegativ Ngtv Weak Submit Passive Vice PowCon PowTotHostile Strong Power Active Milit SocRel IAV PowCon PowTot,NW
3728,OT,Positiv Pstv Virtue Undrst EVAL EndsLwPLACE Region TimeSpcObject Tool,NW
3729,OT,,NW
3730,OT,Active Time@Positiv Pstv Strong Active Exprsv Begin IAV EndsLwNegativ Ngtv Vice Ovrst EVAL NegAff,NW
3731,OT,Strong Active Complet IAV TrnGainSpace TimeSpc,NW
3732,OT,QualityNegativ Ngtv Passive Need EndsLwPositiv Pstv Strong Active Virtue TrnGain,NW
3733,OT,Strong Power Causal PowLoss PowTotPositiv Pstv Affil Strong Active Role HUPower Active TravelStrong Solve IAV,NW
3734,OT,Strong Active Exert IAV TranLwQualityStrong Power Econ@ Role HU WltPt WltTotStrong Active Complet IAV TrnGainMeans,NW
3735,OT,Negativ Ngtv Hostile Active Exert DAV TranLwPositiv Active SocRel DAVNegativ Ngtv Passive Need EndsLw,NW
3736,OT,Strong Active Complet IAV TrnGainNegativ Ngtv Vice Ovrst EVAL NegAffBodyPt WlbPhys WlbTot,NW
3737,OT,Negativ Ngtv Passive Need EndsLwNegativ Hostile Active Exert IAVABS DIST Space TimeSpcObject Tool,NW
3738,OT,Negativ Ngtv Weak Passive Vice Negate MeansLwPositiv Affil Strong IndAdjEcon@ ECON COLL HU WltPt WltTot,NW
3739,RB,QualityABS DIST Space TimeSpc,NW
3740,RB,Positiv Pstv Affil Strong Passive Arousal EMOT AffOth AffTotNegativ Ngtv Hostile Strong Active Vice PowCon PowTot,NW
3741,RB,ABS DIST Space TimeSpcPositiv Econ@ Quan WltOth WltTotPower ComForm EnlGain EnlTot,NW
3742,RB,Active Travel TranLw,NW
3743,RB,Strong Active Increas TimeSpcVirtue SklOth SklTOT,NW
3744,RB,Negativ Ngtv Weak Active Fail DAVWork IAVActive Travel IAV TranLwGoal Abs@ ABS EndsLw,NW
3745,RB,Strong EVAL QualityHostile ComForm PowCon PowTot FormLwNegativ Ngtv Weak Active Fail DAVPowOth PowTot,NW
3746,RB,Solve IAVActive Travel TranLwSpaceQuality,NW
3747,RB,Positiv Pstv Strong Virtue PosAffStrong MeansPositiv Pstv Strong Active Virtue TrnGainNegativ Hostile SocRel Exert IPadj,NW
3748,RB,Negativ Ngtv Hostile Strong Active SocRel IAV TrnLossSpace TimeSpcAcadem Role HU EnlPt EnlTotPositiv Nonadlt IndAdjStrong Power Econ@ Role HU WltPt WltTotStrong NatrPro WltOth WltTot,NW
3749,RB,,NW
3750,RB,Negativ Ngtv Weak Passive Vice EndsLwPassive Arousal EMOTCausal If,NW
3751,RB,Negativ Vice Need IndAdj WlbPsyc WlbTotPositiv Econ@ Quan WltOth WltTotStrong Active Increas EndsLw,NW
3752,RB,Object BldgPt TimeSpcPositiv Pstv Affil SocRel IAV AffGain AffTot,NW
3753,RB,Active Econ@ Work IAVTime@ TimeSpcStrong Active Ovrst Persist,NW
3754,RB,Solve IAVPositiv Pstv Affil Strong Active Role HU,NW
3755,RB,Negativ Ngtv Passive Need EndsLwIAV RcEthic RcTotSpace TimeSpcPassive Goal EnlOth EnlTotPositiv Role HU Know,NW
3756,RB,Strong Active Complet IAV TrnGainPositiv Feel IndAdj,NW
3757,DT,ECON POLIT NameSolve IAV EnlGain EnlTotHostile Strong Power Active Milit SocRel IAV PowCon PowTot,NW
3758,DT,Positiv Pstv Strong Active Exert EVAL WlbPhys WlbTotStrong QualityHostile Role HU PowPt PowTot,NW
3759,DT,QualityStrong Active Exert IAVStrong Work DAV PowOth PowTot,NW
3760,DT,,NW
3761,DT,Hostile Role HU PowPt PowTotObject ToolKnowActive Travel TranLw,NW
3762,DT,ABS DIST Space TimeSpcWork IAVPositiv Affil Strong IndAdj,NW
3763,DT,Positiv NatrPro Know IndAdj,NW
3764,DT,Positiv Pstv Strong Virtue EVAL SklOth SklTOTSpace TimeSpc,NW
3765,DT,Virtue Ovrst EVALMeans WltOth WltTotSpacePositiv Pstv Affil Strong Active Role HU,NW
3766,DT,Active Vary IAVStrong Complet IAV TrnGainNegativ Ngtv Weak Vice EVAL Negate EndsLw,NW
3767,DT,Positiv Nonadlt IndAdjNegativ Hostile Vice,NW
3768,DT,Negativ Ngtv Weak Passive Vice EndsLwStrong SpaceECON POLIT NameStrong EVAL QualityStrong Active Fetch DAV TranLwPositiv Pstv Affil Strong Active Role HU,NW
3769,DT,Negativ Ngtv Passive Need EndsLwPositiv Nonadlt IndAdjIAV RcEthic RcTotNegativ Ngtv Strong Active NatrPro PowOth PowTotPositiv Pstv Active ComForm DAV EnlGain EnlTot,NW
3770,DT,PLACE Region ArenaLwStrong Power Active Exert IAV PowOth PowTotPositiv Eval@ Quality IndAdj,NW
3771,DT,Solve IAVWeak Submit Passive Rel DAVPositiv Strong Virtue,NW
3772,DT,Hostile Strong Active Stay IAV PowCon PowTotStrong ComForm EnlOth EnlTot FormLw,NW
3773,DT,Positiv Pleasur EMOT StaySpacePositiv Pstv Affil Strong Active Role HU,NW
3774,DT,,NW
3775,DT,Strong Virtue EndsLwSolve IAV,NW
3776,CB,Power ECON Polit@ POLIT COLL HU PowAuPt PowTotPositiv Pstv Strong Virtue Exprsv,NW
3777,CB,Active Ovrst Travel IAV,NW
3778,CB,ABS DIST Space TimeSpcActive SpacePositiv Role HU Know,NW
3779,CB,Positiv Nonadlt IndAdjPositiv Pstv Virtue Undrst EVAL EndsLwPassive Virtue RcEnds RcTot,NW
3780,CB,Positiv Pstv Strong Active Virtue SklOth SklTOTNegativ Ngtv Role HU,NW
3781,CB,Passive Arousal,NW
3782,CB,Negativ Hostile ViceStrong Ovrst Quan SureLw,NW
3783,CB,Space TimeSpcBodyPtABS DIST SpaceECON Exprsv Ritual,NW
3784,CB,Strong Active Fall IAVSubmit Passive Role HU,NW
3785,CB,Positiv Nonadlt IndAdj,NW
3786,CB,Active ECON Means,NW
3787,CB,Negativ Ngtv Vice EnlOth EnlTotPositiv Pstv Virtue Econ@ ECON WltOth WltTot,NW
3788,CB,BodyPtStrong Power Causal PowLoss PowTotNegativ Ngtv Strong Active NatrPro PowOth PowTotEcon@ ECON ComForm COM FormLw,NW
3789,CB,Negativ Ngtv Weak Passive Persist IAV TranLwRitualObject Tool,NW
3790,CB,Negativ Ngtv Weak Active Fail DAV,NW
3791,CB,Negativ Strong Power Active Exert IAVPositiv Strong Active Increas,NW
3792,CB,QualityStrong Quan DIMSubmit Passive Role HU,NW
3793,CB,Negativ Ngtv Hostile Strong Active SocRel IAV PowLoss PowTot,NW
3794,CB,Strong Ovrst Quan SureLwPositiv Nonadlt IndAdjHostile Strong Active Stay IAV PowCon PowTot,NW
3795,CB,Positiv Pstv Strong Active Virtue TrnGainPositiv Strong Virtue EVAL Abs@ ABS MeansLwAbs@ ABS Time@Strong Means EndsLw,NW
3796,CB,Positiv Pstv Virtue Undrst EVAL EndsLwPerceiv EnlOth EnlTot,NW
3797,CB,Positiv Strong Virtue EVAL Abs@ ABS MeansLwSubmit Passive Role HUECON Exprsv RitualSpaceStrong Space,NW
3798,CB,Academ Doctrin EnlOth EnlTotNatrProStrong Active Complet IAV TrnGainStrong ComForm EnlOth EnlTot FormLw,NW
3799,CB,Means WltOth WltTotPositiv Nonadlt IndAdjStrong Active Complet IAV TrnGain,NW
3800,CB,Strong Active Exert IAVNegativ Active Try IAVPositiv Nonadlt IndAdj,NW
3801,CB,Solve IAVABS DIST Space TimeSpcBodyPtPositiv Pstv Passive VirtuePositiv Pstv Strong Virtue EVAL SklOth SklTOTStrong Means EndsLw,NW
3802,CB,Positiv Strong VirtueStrong Means EndsLw,NW
3803,CB,Negativ Ngtv Weak Passive Vice EndsLwPLACE Region TimeSpcPositiv Strong Virtue,NW
3804,CB,Negativ Ngtv Weak Passive Persist IAV TranLwStrong Active Fall IAVObject ToolPower Active TravelSpace,NW
3805,CB,Passive Arousal EMOT,NW
3806,CB,Passive Goal EnlOth EnlTotECON Exprsv RitualSpace,NW
3807,CB,Negativ OvrstLegal Role HU SklPt SklTOTStrong Work DAV PowOth PowTotSubmit Passive Role HU,NW
3808,CB,Weak Submit Passive Arousal PowOth PowTotHostile Role HU PowPt PowTotStrong Active Complet IAV TrnGainStrong ComForm EnlOth EnlTot FormLw,NW
3809,RB,Econ@ ECON Rel PowOth PowTotPositiv Pstv Virtue Undrst EVAL EndsLwMeans WltOth WltTot,NW
3810,RB,Know WlbPsyc WlbTotPositiv Strong Power Active SocRel IAV PowLoss PowTotNegativ ViceSpace,NW
3811,RB,Positiv Pstv Virtue EVAL PosAffBodyPt WlbPhys WlbTotWeak Submit Passive Rel DAVQualityNegativ Ngtv Weak Passive Vice Abs@ ABS WltTran WltTot,NW
3812,RB,Passive Perceiv IAV EnlOth EnlTotActive Exert DAVPositiv Pstv Virtue Abs@ ABS EndsLw,NW
3813,RB,Virtue SklOth SklTOTStrong Active Fall IAV,NW
3814,RB,Hostile Strong Power Active Milit SocRel IAV PowCon PowTotPassive Quan TimeSpc,NW
3815,RB,Travel IAVPositiv Pstv Active ComForm DAV EnlGain EnlTot,NW
3816,RB,Strong EVAL QualityHostile ComForm PowCon PowTot FormLwHostile Exert IAV,NW
